{
  "schema_version": "1.0.0",
  "status": "proposed",
  "generated_at": "2026-09-05",
  "metadata": {
    "purpose": "Initial, reviewable task-family keyword seeds for Physical AI Task Atlas.",
    "frequency_interpretation": "signal_types separate population_frequency_prior, dataset_recurrence, and research_signal. They are not interchangeable measurements.",
    "skills_interpretation": "Each family.skills value is a reusable skill-vocabulary candidate, not a foreign key to data/seeds/skills.json. Review and add an explicit mapping to seed Skill IDs before using it as a graph reference.",
    "version_caveats": [
      "AgiBot World paper v4 reports 1001552 trajectories; the Beta distribution repository reports 1003672. Preserve source_version and retrieval date for any derived count.",
      "BEHAVIOR-1K activity families and task-definition variants are distinct; do not use a family count as a variant count.",
      "RoboCasa v1.0.1 dataset documentation and RoboCasa365 describe separate releases and must remain separate source records.",
      "ATUS values describe United States civilian population age 15+ primary activities and daily averages; they are not robot-action frequencies.",
      "ICATUS 2016 is an activity taxonomy, not a population-frequency source."
    ],
    "review_rules": [
      "Treat every family as a candidate until a task template, evidence record, and evaluation protocol are reviewed.",
      "Keep source claims versioned and do not infer quantitative frequency from dataset inclusion alone."
    ]
  },
  "source_registry": [
    { "id": "agibot_world_paper_v4", "kind": "paper", "source_version": "arXiv v4", "retrieved_at": "2026-09-05", "url": "https://arxiv.org/html/2503.06669v4", "use": "task, skill, scene, collection, and recovery signals" },
    { "id": "agibot_world_beta_repo", "kind": "dataset_repository", "source_version": "Beta repository", "retrieved_at": "2026-09-05", "url": "https://github.com/OpenDriveLab/Agibot-World", "use": "distribution-version caveat" },
    { "id": "behavior_1k_definitions", "kind": "dataset_documentation", "source_version": "main branch", "retrieved_at": "2026-09-05", "url": "https://github.com/StanfordVL/BEHAVIOR-1K/blob/main/docs/behavior_components/behavior_tasks.md", "use": "object, initial-condition, and goal-condition task structure" },
    { "id": "behavior_1k_paper", "kind": "paper", "source_version": "arXiv", "retrieved_at": "2026-09-05", "url": "https://arxiv.org/abs/2403.09227", "use": "household activity and simulation scope" },
    { "id": "robocasa_v101_docs", "kind": "dataset_documentation", "source_version": "v1.0.1 documentation", "retrieved_at": "2026-09-05", "url": "https://robocasa.ai/docs/build/html/datasets/datasets_overview.html", "use": "atomic/composite task and subtask annotation signals" },
    { "id": "robocasa365", "kind": "dataset_release", "source_version": "RoboCasa365", "retrieved_at": "2026-09-05", "url": "https://robocasa.ai/", "use": "newer release kept separate from v1.0.1" },
    { "id": "droid_dataset", "kind": "dataset_documentation", "source_version": "official site", "retrieved_at": "2026-09-05", "url": "https://droid-dataset.github.io/", "use": "real-world, distributed collection recurrence" },
    { "id": "open_x_embodiment_paper", "kind": "paper", "source_version": "arXiv", "retrieved_at": "2026-09-05", "url": "https://arxiv.org/abs/2310.08864", "use": "cross-embodiment common-skill signal" },
    { "id": "bridgedata_v2_paper", "kind": "paper", "source_version": "PMLR 229", "retrieved_at": "2026-09-05", "url": "https://proceedings.mlr.press/v229/walke23a/walke23a.pdf", "use": "basic, environment, and complex manipulation recurrence" },
    { "id": "robotwin_20_paper", "kind": "paper", "source_version": "arXiv", "retrieved_at": "2026-09-05", "url": "https://arxiv.org/abs/2506.18088", "use": "bimanual and variation-axis research signal" },
    { "id": "atus_2024", "kind": "government_statistics", "source_version": "2024 release", "retrieved_at": "2026-09-05", "url": "https://www.bls.gov/news.release/archives/atus_06262025.htm", "use": "population activity prior only; primary activities" },
    { "id": "icatus_2016", "kind": "international_taxonomy", "source_version": "2016", "retrieved_at": "2026-09-05", "url": "https://unstats.un.org/unsd/demographic-social/time-use/icatus-2016/", "use": "activity taxonomy only; no frequency value" }
  ],
  "families": [
    { "id": "pick_place", "label_en": "Pick and place", "label_ja": "把持・配置", "priority": "P0", "signal_types": ["dataset_recurrence", "research_signal"], "verbs": ["pick", "grasp", "lift", "place", "put", "release"], "object_roles": ["movable_object", "support_surface", "destination"], "state_atoms": ["reachable", "grasped", "lifted", "supported", "released"], "scene_roots": ["tabletop", "kitchen", "retail_shelf", "workbench"], "goal_patterns": ["object_on_surface", "object_in_container", "object_at_target_pose"], "skills": ["reach", "grasp", "lift", "transport", "place"], "variant_axes": ["object_shape", "object_pose", "destination_height", "clutter", "camera_view"], "failure_modes": ["missed_grasp", "slip", "collision", "misplacement"], "evidence": ["open_x_embodiment_paper", "bridgedata_v2_paper", "agibot_world_paper_v4"], "selection_reason": "Cross-embodiment baseline that composes into most household and service tasks.", "frequency_status": "dataset_and_research_supported_not_population_measured" },
    { "id": "retrieve_store", "label_en": "Retrieve and store", "label_ja": "取り出し・収納", "priority": "P0", "signal_types": ["population_frequency_prior", "dataset_recurrence", "research_signal"], "verbs": ["retrieve", "take_out", "store", "put_away", "return"], "object_roles": ["stored_object", "storage", "destination"], "state_atoms": ["inside_storage", "accessible", "removed", "stored"], "scene_roots": ["kitchen", "pantry", "cabinet", "retail_shelf"], "goal_patterns": ["object_removed_from_storage", "object_inside_storage"], "skills": ["open", "reach", "grasp", "transport", "place"], "variant_axes": ["storage_type", "shelf_height", "occlusion", "object_category"], "failure_modes": ["unreachable_object", "door_obstruction", "wrong_item", "unstable_storage"], "evidence": ["atus_2024", "icatus_2016", "behavior_1k_definitions", "robocasa_v101_docs"], "selection_reason": "Connects household storage activity with compositional manipulation benchmarks.", "frequency_status": "population_prior_is_activity_level_only" },
    { "id": "open_close", "label_en": "Open and close", "label_ja": "開閉", "priority": "P0", "signal_types": ["dataset_recurrence", "research_signal"], "verbs": ["open", "close", "pull", "push", "unlatch"], "object_roles": ["articulated_object", "handle", "contents"], "state_atoms": ["closed", "open", "latched", "unlatched"], "scene_roots": ["kitchen", "cabinet", "drawer", "appliance"], "goal_patterns": ["articulated_object_open", "articulated_object_closed"], "skills": ["reach", "grasp_handle", "pull_or_push", "release"], "variant_axes": ["hinge_or_slider", "handle_geometry", "opening_direction", "resistance"], "failure_modes": ["handle_miss", "insufficient_force", "collision", "partial_open"], "evidence": ["bridgedata_v2_paper", "behavior_1k_definitions", "robocasa_v101_docs"], "selection_reason": "Environment interaction expands beyond free-object transport.", "frequency_status": "dataset_and_research_supported_not_population_measured" },
    { "id": "container_transfer", "label_en": "Container transfer", "label_ja": "容器間移し替え", "priority": "P0", "signal_types": ["population_frequency_prior", "dataset_recurrence", "research_signal"], "verbs": ["transfer", "scoop", "move", "empty", "fill"], "object_roles": ["source_container", "target_container", "contents", "tool"], "state_atoms": ["contains_item", "opened", "emptied", "filled"], "scene_roots": ["kitchen", "dining", "lab_bench"], "goal_patterns": ["contents_in_target", "source_partially_empty"], "skills": ["grasp", "align", "tilt_or_scoop", "place"], "variant_axes": ["contents_type", "container_geometry", "fill_level", "target_opening"], "failure_modes": ["spill", "missed_target", "overfill", "contamination"], "evidence": ["atus_2024", "icatus_2016", "agibot_world_paper_v4", "robocasa_v101_docs"], "selection_reason": "Common meal-preparation structure with explicit state change and contact constraints.", "frequency_status": "population_prior_is_activity_level_only" },
    { "id": "pour_transfer", "label_en": "Pour and dispense", "label_ja": "注ぐ・分注", "priority": "P0", "signal_types": ["population_frequency_prior", "dataset_recurrence", "research_signal"], "verbs": ["pour", "dispense", "tilt", "serve"], "object_roles": ["source_vessel", "target_vessel", "liquid_or_granular_content"], "state_atoms": ["sealed", "open", "upright", "tilted", "filled"], "scene_roots": ["kitchen", "dining", "cafe"], "goal_patterns": ["target_contains_content", "target_fill_level_reached"], "skills": ["grasp", "lift", "align", "controlled_tilt", "reorient"], "variant_axes": ["viscosity", "fill_level", "container_handle", "target_size"], "failure_modes": ["spill", "overpour", "underpour", "collision"], "evidence": ["atus_2024", "icatus_2016", "agibot_world_paper_v4"], "selection_reason": "AgiBot evaluation and daily food activity jointly motivate liquid-transfer coverage.", "frequency_status": "population_prior_is_activity_level_only" },